{
  "schema_version": "1",
  "issue": {
    "key": "TC-8002",
    "summary": "CVE-2026-28940 serde_json - Stack overflow on deeply nested input [rhtpa-2.2]",
    "description": {
      "type": "doc",
      "version": 1,
      "content": [
        {
          "type": "paragraph",
          "content": [
            {
              "type": "text",
              "text": "A vulnerability was found in serde_json. Versions of serde_json before 1.0.135 are vulnerable to a stack overflow when deserializing deeply nested JSON input. An attacker can craft a JSON payload with thousands of nested arrays or objects that causes unbounded recursion during deserialization, leading to a stack overflow and process crash.\n\n**Affected package**: serde_json\n**Affected versions**: versions before 1.0.135\n**Fixed version**: 1.0.135\n**CVSS**: 5.3 (Medium)\n\nThe fix introduces a configurable recursion limit that defaults to 128 levels of nesting.\n\n### References\n\n- https://github.com/advisories/GHSA-2026-j9r2-m5vk\n- https://rustsec.org/advisories/RUSTSEC-2026-0019.html"
            }
          ]
        }
      ]
    },
    "status": "New",
    "labels": [
      "CVE-2026-28940",
      "pscomponent:org/rhtpa-server"
    ],
    "versions": [],
    "reporter": {
      "account_id": "synthetic-reporter",
      "display_name": "Synthetic Reporter"
    },
    "comments": [],
    "fields": {
      "fixture_purpose": "SYNTHETIC TEST DATA — independent Fullsend counterpart of interactive eval 2; all identities, URLs, CVEs, commit pins and evidence are deliberate public test material, not live advisory evidence.",
      "current_user": {
        "accountId": "synthetic-engineer",
        "displayName": "Synthetic Engineer"
      },
      "ecosystem": "Cargo",
      "affected_package": "serde_json",
      "fixed_version": "1.0.135",
      "affected_range": "< 1.0.135",
      "affectsVersions": [
        {
          "id": "version-stale",
          "name": "RHTPA 2.0.0"
        }
      ],
      "assignee": null,
      "issuelinks": [],
      "customfield_10632": "serde_json"
    }
  },
  "remote_links": [
    {
      "url": "https://example.com/advisories/CVE-2026-28940",
      "title": "Synthetic CVE-2026-28940 advisory"
    }
  ],
  "configuration": {
    "project_key": "TC",
    "jira_version_prefix": "RHTPA",
    "vulnerability_issue_type_id": "10016",
    "component_label_pattern": "pscomponent:",
    "version_streams": [
      {
        "name": "2.1.x",
        "matrix_path": "2.1.x/security-matrix.md",
        "release_repository": "release-repo"
      },
      {
        "name": "2.2.x",
        "matrix_path": "2.2.x/security-matrix.md",
        "release_repository": "release-repo"
      }
    ],
    "source_repositories": [
      {
        "name": "backend",
        "url": "https://github.com/example/backend",
        "deployment_context": "customer-shipped"
      }
    ],
    "vex_justification_field": "customfield_10665",
    "upstream_affected_component_field": "customfield_10632",
    "stream_field": "customfield_10832"
  },
  "external_evidence": {
    "mitre": {
      "source_url": "https://example.com/mitre/CVE-2026-28940",
      "retrieved_at": "2026-09-30T12:00:00Z",
      "status": 200,
      "body": {
        "cveMetadata": {
          "cveId": "CVE-2026-28940"
        },
        "containers": {
          "cna": {
            "affected": [
              {
                "product": "serde_json",
                "versions": [
                  {
                    "status": "affected",
                    "lessThan": "1.0.135",
                    "versionType": "semver"
                  }
                ]
              }
            ]
          }
        }
      }
    },
    "osv": {
      "source_url": "https://example.com/osv/CVE-2026-28940",
      "retrieved_at": "2026-09-30T12:00:00Z",
      "status": 200,
      "body": {
        "id": "CVE-2026-28940",
        "affected": [
          {
            "package": {
              "ecosystem": "Cargo",
              "name": "serde_json"
            },
            "ranges": [
              {
                "type": "SEMVER",
                "events": [
                  {
                    "introduced": "0"
                  },
                  {
                    "fixed": "1.0.135"
                  }
                ]
              }
            ]
          }
        ]
      }
    },
    "lifecycle": {
      "source_url": "https://example.com/lifecycle",
      "retrieved_at": "2026-09-30T12:00:00Z",
      "status": 200,
      "body": {
        "supported_streams": [
          "2.1.x",
          "2.2.x"
        ],
        "eol_streams": []
      }
    }
  },
  "matrix": {
    "streams": [
      {
        "name": "2.1.x",
        "matrix_source": "SYNTHETIC TEST DATA — trusted 2.1.x matrix snapshot",
        "rows": [
          {
            "version": "2.1.0",
            "source_commits": {
              "backend": "a003008"
            },
            "retag_of": null
          },
          {
            "version": "2.1.1",
            "source_commits": {
              "backend": "a003012"
            },
            "retag_of": null
          }
        ]
      },
      {
        "name": "2.2.x",
        "matrix_source": "SYNTHETIC TEST DATA — trusted 2.2.x matrix snapshot",
        "rows": [
          {
            "version": "2.2.0",
            "source_commits": {
              "backend": "a004005"
            },
            "retag_of": null
          },
          {
            "version": "2.2.1",
            "source_commits": {
              "backend": "a004008"
            },
            "retag_of": null
          },
          {
            "version": "2.2.2",
            "source_commits": {
              "backend": "a004008"
            },
            "retag_of": "2.2.1"
          },
          {
            "version": "2.2.3",
            "source_commits": {
              "backend": "a004011"
            },
            "retag_of": null
          },
          {
            "version": "2.2.4",
            "source_commits": {
              "backend": "a004012"
            },
            "retag_of": null
          }
        ]
      }
    ]
  },
  "source_evidence": {
    "lock_files": [
      {
        "repository": "backend",
        "ref": "a003008",
        "path": "Cargo.lock",
        "command": "git show a003008:Cargo.lock",
        "content": "[[package]]\nname = \"serde_json\"\nversion = \"1.0.137\"\n"
      },
      {
        "repository": "backend",
        "ref": "a003012",
        "path": "Cargo.lock",
        "command": "git show a003012:Cargo.lock",
        "content": "[[package]]\nname = \"serde_json\"\nversion = \"1.0.137\"\n"
      },
      {
        "repository": "backend",
        "ref": "a004005",
        "path": "Cargo.lock",
        "command": "git show a004005:Cargo.lock",
        "content": "[[package]]\nname = \"serde_json\"\nversion = \"1.0.138\"\n"
      },
      {
        "repository": "backend",
        "ref": "a004008",
        "path": "Cargo.lock",
        "command": "git show a004008:Cargo.lock",
        "content": "[[package]]\nname = \"serde_json\"\nversion = \"1.0.138\"\n"
      },
      {
        "repository": "backend",
        "ref": "a004011",
        "path": "Cargo.lock",
        "command": "git show a004011:Cargo.lock",
        "content": "[[package]]\nname = \"serde_json\"\nversion = \"1.0.139\"\n"
      },
      {
        "repository": "backend",
        "ref": "a004012",
        "path": "Cargo.lock",
        "command": "git show a004012:Cargo.lock",
        "content": "[[package]]\nname = \"serde_json\"\nversion = \"1.0.139\"\n"
      }
    ],
    "development_streams": [
      {
        "repository": "backend",
        "ref": "release/0.3.z",
        "path": "Cargo.lock",
        "command": "git show release/0.3.z:Cargo.lock",
        "content": "[[package]]\nname = \"serde_json\"\nversion = \"1.0.135\"\n"
      },
      {
        "repository": "backend",
        "ref": "release/0.4.z",
        "path": "Cargo.lock",
        "command": "git show release/0.4.z:Cargo.lock",
        "content": "[[package]]\nname = \"serde_json\"\nversion = \"1.0.135\"\n"
      }
    ]
  },
  "jira_metadata": {
    "versions": [
      {
        "id": "version-2-1-0",
        "name": "RHTPA 2.1.0",
        "released": true
      },
      {
        "id": "version-2-1-1",
        "name": "RHTPA 2.1.1",
        "released": true
      },
      {
        "id": "version-2-2-0",
        "name": "RHTPA 2.2.0",
        "released": true
      },
      {
        "id": "version-2-2-1",
        "name": "RHTPA 2.2.1",
        "released": true
      },
      {
        "id": "version-2-2-2",
        "name": "RHTPA 2.2.2",
        "released": true
      },
      {
        "id": "version-2-2-3",
        "name": "RHTPA 2.2.3",
        "released": true
      },
      {
        "id": "version-2-2-4",
        "name": "RHTPA 2.2.4",
        "released": true
      },
      {
        "id": "version-dev",
        "name": "RHTPA 2.2.5",
        "released": false
      }
    ],
    "sibling_searches": [],
    "related_issues": []
  },
  "idempotency": {
    "action_markers": [],
    "existing_remediation": []
  },
  "authorization": {
    "mutation_authorized": false
  }
}
